Date,Time,Town,County,Occupation,Description
2009-09-24,22:00,Westonbirt,Gloucestershire,,"A ball of light the size of a small car, 26 metres above the ground. It 
pulsated every 5-8 seconds but then shot off. Definitely not an 
aircraft or a Chinese Lantern."
2009-09-24,01:50,Cheshunt,Herts,,"A bright orange light, which hovered in one place. It became more 
pink, than red and then it disappeared."
2009-09-24,02:35,"Weston Super 
Mare",Somerset,,"A metallic aircraft shaped like a missile. One quarter was white, 
another green/blue and another red. Was circling. It had no wings 
and was moving diagonally. It made a sound like a motorbike."
2009-09-26,22:30,Ruislip,Middlesex,,"Three bright orange lights, not flashing. Very big, high up, set 
equally apart. Reported it to RAF Northolt. Never saw anything like 
this before."
2009-09-26,22:35,River Severn,Gloucestershire,,"A UFO of orangey/red colour. It hovered and moved slightly in the 
direction of Stroud, then suddenly dropped downwards."
2009-09-26,01:22,Newport,Gwent,,"A bright, reddish light travelling W to E, below cloud level. It made 
no sound. It was moving in a straight line but too slow to be a 
meteorite. It had no navigation type lights."
2009-09-26,09:01,Not Given,Not Given,,"10-12 bright orange objects, silent. Has a photo of them saved on 
his mobile."
2009-09-26,22:30,Sheffield,Yorkshire,,"Six yellow lights, stationary at first then moved off."
2009-09-26,22:55,Nottingham,Nottinghamshire,Ex-police,"Four-five orange lights, fluctuating lights. Lives under flight path of 
Donnington airfield. Objects moved in a line. Lights faded. Returned 
10 minutes later."
2009-09-26,23:00,Not Given,Cornwall,,"Video footage in Cornwall near an Air Station (possibly Culdrose). 
Five minute sighting."
2009-09-26,12:48,Hitchin,Hertfordshire,,"Large round object. Two planes flew round it. Could be something 
natural, such as an eclipse."
2009-09-26,Not Given,Ashburton,Devon,,"Light seen in sky also above this was a large round shape which 
looked rocky and was blue and pink in colour."
2009-09-26,10:03,Newmarket,Suffolk,,"15 to 20 orange and red lights looked as though they were coming 
down to land but then went over head and 'went out'."
2009-09-27,11:00,Edinburgh,Scotland,,"Saw through the clouds flashing pale blue lights odd shapes but 
mostly circles. Movement continued for 25 minutes. A small red light 
was on outside parameter of blue lights which 
disappeared/amalgamated into one large blue light which speedily 
disappeared."
2009-09-27,23:20,Barking,Essex,,"Bright, oval shaped object with red and green lights. No noise."
2009-09-27,23:57,Bradford,Yorkshire,,"Large balloon shape, with 'shimmer fire' effect underneath it."
2009-10-04,10:45,Henley on ThamesOxfordshire,,,"Six orange, with fire around, UFOs in formation (One behind the 
other across horizon to horizon)."
2009-10-04,11:00,Plymouth,Devon,"Professional 
Photographer","Six orange/white lights, lying astern.  Thought they were aircraft 
navigation lights but were evenly spaced out.  No noise but moved 
with speed of a passing helicopter. Changed into a 'hammer head' 
shape."
2009-10-04,11:00,Dumfries,Scotland,,"Six or seven bright lights which were in the sky for approximately 10 
minutes. They were spaced out and one by flew away and 
disappeared very quickly."
2009-10-16,22:30,Elgin,Moray,,"Lights moving slowly. One light lead a group of five, with one light 
acting as tail ender."
2009-10-16,22:57,Michell Coldon,,Police,"17 UFO's above village. Red and green lights, no sound."
2009-10-16,00:22,Shirley,Croydon,,"Orange point of light in the sky.  No haze or smoke visible around 
the object. Object was flickering slightly. Lasted about 60 secs."
2009-10-16,14:00,Hauxton,Cambridgeshire,"Retired merchant 
seaman","Saw glider like objects in the sky. Flying around in an anti-clockwise 
direction."
2009-10-16,21:30,Not Given,Not Given,,"Red object, looked like a clod, went over the roof and vanished. No 
noise/engine. Big orange colour lower than a plane. Gliding straight."
2009-10-26,22:18,Coningsby,Lincolnshire,,"Four wavering lights, hovering, taken on a video camera and 
photographed."
2009-10-26,22:45,Newport,Shropshire,Retired RAF,"Two yellow lights one above the other in the sky.  On arriving home 
five minutes later watched the lights disappear behind a narrow 
cloud bank."
2009-10-26,Not Given,Not Given,Not Given,,"Two sightings observed. One in summer 2008 single bright 
yellow/white light moving fast. Second sighting in daylight single 
bright yellow/white 2009 moving fast."
2009-10-27,00:05,East Kilbride,Lanarkshire,,"Bright orange bulb. Stayed for 10 minutes, came towards him like a 
tornado then disappeared."
2009-10-27,09:45,Stockport,Cheshire,,"Bright orange object which looked as though it was on fire. Moving 
at a steady pace, slowed then gained altitude slowly and 
disappeared into the clouds.  Sighting lasted 2-3 minutes.  Object 
was similar to a hot air balloon but had no outline or shape."
2009-10-27,20:45,Not Given,Not Given,,"Bright light form the northwest - lights went out, turned towards the 
south."
2009-11-01,20:55,Northampton,Northamptonshire,,"Saw 40 flickering orange lights from kitchen window. They made no 
noise and moved round to the side window of the house and 
disappeared behind a cloud.  Watched them for 5-10 minutes."
2009-11-01,22:00,Stevenage,Hertfordshire,,"Two orbs, flickering lights, sliding across the sky."
2009-11-01,22:20,Gerrards Cross,Buckinghamshire,,"Around eight yellow balls of light floating slowly in the night sky, 
slowly disappearing. Then one or two more would appear 500 to 800 
ft and follow same line of flight.  This happened for around two 
minutes."
2009-11-03,00:00,Tunbridge Wells,Kent,,"Bright orange lights, lasted for two minutes, went out, than four 
more. Could have been a meteorological balloon. A very bright light."
2009-11-03,03:30,Swindon,Wiltshire,,"Three lights in formation, forming an isosceles triangle. Two lights 
visible at first, then joined by a third. Light lasted for 2-3 minutes. No 
sound."
2009-11-03,21:45,Hersham,Surrey,,"A large orange fireball burning for 35 seconds. No noise from object 
which reduced in size until nothing over the duration of its flight."
2009-11-03,23:30,Glasgow,Strathclyde,,Strange lights over G62 0TD. Two big white lights.
2009-11-07,12:10,Petts Wood,Kent,,"Saw eight orange single lights in the sky. Lights were very clear, 
single bright orange spot, which travelled at constant speed slowly 
higher into the eastern atmosphere. At first four lights in close 
proximity followed by four more with approx one minute."
2009-11-07,Not Given,Ashingdon HeightsEssex,,,"Approx 10 orange lights flying over. First eight were going at a 
steady, slow rate, three of which merged into a triangle formation, 
separated then disappeared. Two others appeared about a minute or 
so travelling faster and disappeared at same area of sky."
2009-11-07,17:00,Not Given,Thames Estuary,,"Saw a vertical cylinder, silvery colour and underneath was a great 
bright yellow, fiery glow.  Watched the object for about 20 minutes."
2009-11-07,Not Given,Catford,London,,"Six bright orange lights - not flashing - silent. After a few minutes 
there was another one."
2009-11-07,21:00,Sherborne,Dorset,,"Saw a very bright light - looking south to right of the moon.  It was 
very large.  There were four or five bright lights."
2009-11-07,11:00,Inverness,Scotland,,"Moving very fast SE to North and watched object for about 10 
seconds. Thought at first it was a star or a plane."
2009-11-07,00:46,Filey,Yorkshire,,"Brilliant and dazzling pure white horizontal ring of light.  It appeared 
to be perfectly still in the sky above the houses and was totally 
silent.  Object was hovering over the Belle Vue Crescent area."
2009-11-07,23:15,Ashton Under Lyne,"Greater 
Manchester",,"Eight, orange UFOs, shone brightly, travelling at speed, low in the 
sky. Objects came across one by one with approx 20 seconds 
between them. They stopped over the reservoir changed direction at 
approx 90 deg angle towards Holmfirth.  No noise."
2009-11-14,11:30,Charles Barn,Kent,,"White fixed wing object. Flying over a field, East Street, Charles 
Barn.  It was squared off with something behind it - no cockpit- silent 
not a glider."
2009-11-14,20:45,Not Given,"Not Given
Ashton-under-",,"Saw over the roof of their house orange/gold round circle about the 
size of a beach ball moving from behind the house going sideways 
across the roof  and down the road. As it moved down the road it 
change to a smaller light with no fiery glow."
2009-11-14,11:23,Belfast,Northern Ireland,,"Three blazing gold orbs in a diagonal line in the sky. No sound. 
Remained static approx one minute before moving slowly together 
to form a shape like Orion's Belt and then into a small triangle. Two 
lights further out faded and disappeared then third too."
2009-11-25,22:00,New Forest,Hampshire,,"Saw an object in sky like a fireball. It burnt pretty brightly, then would 
burn out a little then appear to burn brightly again before 
extinguishing about thirty seconds later."
2009-11-25,22:00,Sheepridge,Huddersfield,,"Six to eight red lights moving across the skyline. Red spheres with a 
white centre. Eventually passed over the house from back to the 
front."
2009-11-29,20:19,Anglesy,North Wales,,"Object was similar to an egg shape and was amber in colour and 
appeared to be hovering over  field's before disappearing.  Five 
minutes later two objects appeared in same area, then disappeared 
and reappeared over the Meni Straits."
